job_title,salary_estimate,midpoint_salary_estimate,job_description,company_name,location,size,type_of_ownership,industry
"Principal Data Analyst, LATAM - Disney Streaming Services",$46K-$87K (Glassdoor est.),66500,"Job Summary:Comprised of Disney's international media businesses and the Company's various streaming services, the Direct-to-Consumer and International (DTCI) segment aligns technology, content and distribution platforms to expand the Company's global footprint and deliver world-class, personalized entertainment experiences to consumers around the world.The Walt Disney Company's Direct-to-Consumer and International segment (DTCI) is a global, multiplatform media, technology and distribution organization for high-quality content created by Disney's Studio Entertainment and Media Networks groups.DTCI includes Disney's international media operations and the Company's direct-to-consumer businesses globally, including the upcoming Disney-branded direct-to-consumer streaming service, the Company's ownership stake in Hulu, and the ESPN+ sports streaming service, programmed in partnership with ESPN. BAMTECH Media, developer of the ESPN+ and Disney-branded streaming platforms, oversees all consumer-facing digital technology and products across the Company as part of the Direct-to-Consumer and International segment.Regional teams in Disney Streaming partner with local content, marketing, business, and data partners to inform decision-making at scale. As Principal Data Analyst for DSS LATAM Analytics, you will be the direct partner to the regional LATAM Disney+ team, working hand-in-hand to: ensure widespread communication of insights, reports, and tools; highlight best practices; identify and anticipate opportunities for data-driven decision-making; and lead project teams to achieve critical objectives by driving close collaboration between organizations.Responsibilities:* Partnership: Be the connection between the Disney Streaming data teams and the LATAM data team, influencing and coordinating between teams to facilitate communication and consistently deliver high quality results.* Project Management: Plan, track, and socialize complex cross-functional projects across teams (technical and non-technical) and leaders within DSS and LATAM.* Reporting & Automation at Scale: Partner closely with DSS data teams & the LATAM D+ Data team to understand existing reporting capability and modify/build as needed to address self-service and push-reporting needs at scale.* Ideate & Innovate: Identify, anticipate, and execute on opportunities to deliver impact by knowing the right approach: adapting existing tools and algorithms in novel ways, or building capability from scratch. Keep abreast of emerging technologies and ensure that analytical approaches are designed to incorporate new platforms and trends.* Hands-on Analysis: Conduct complex targeted ad hoc descriptive and statistical analysis to inform regional decision-making to address critical and strategic issues.* Leadership: Mentor junior and senior members of the team to improve their skills and knowledge. Serve as the subject matter expert in relevant technical areas.Basic Qualifications:* Fluency in English and Spanish is required.* 6+ years of analytical experience, including expert hands-on experience with SQL, project and technical leadership.* Expertise with Python/R or other statistical programming language a plus* Expertise in data exploration and data visualization tools like Tableau or Looker* Excellence in communicating technical results to non-technical audiences. Experience in presenting to executive audiences is strongly preferred.* Ability to think strategically, and analyze and interpret market and consumer information* Strong interpersonal and relationship management skills particularly with technical or engineering functions* Excellent judgement in selecting methods and/or techniques to resolve issues and challenges.Preferred Qualifications:* Experience with streaming services is a plus!Preferred Education* Advanced degree (PhD or MS) in an analytical field or equivalent experience preferred.About Disney Streaming Services:Disney Streaming Services is responsible for developing and operating The Walt Disney Company's direct-to-consumer video businesses globally, including the ESPN+ premium sports streaming service; Disney+, the dedicated streaming home for entertainment from Disney, Pixar, Marvel, Star Wars, National Geographic and BAMTECH Media, a global leader in direct-to-consumer video streaming products and solutions. Our core mission is to deliver global audiences the freedom to access content on their terms across any connected device, time or location. We serve consumers by bringing the world's most beloved characters, timeless stories, legendary athletes, and epic sporting events to global audiences through best-in-class direct-to-consumer video services. We strive daily to imaginatively challenge convention with innovative technology that gives consumers the freedom to access content on their terms across any connected device, time or location.About The Walt Disney Company:The Walt Disney Company, together with its subsidiaries and affiliates, is a leading diversified international family entertainment and media enterprise with the following business segments: media networks, parks and resorts, studio entertainment, consumer products and interactive media. From humble beginnings as a cartoon studio in the 1920s to its preeminent name in the entertainment industry today, Disney proudly continues its legacy of creating world-class stories and experiences for every member of the family. Disney's stories, characters and experiences reach consumers and guests from every corner of the globe. With operations in more than 40 countries, our employees and cast members work together to create entertainment experiences that are both universally and locally cherished.This position is with Disney Streaming Services LLC, which is part of a business segment we call Disney Streaming Services.Disney Streaming Services LLC is an equal opportunity employer. Applicants will receive consideration for employment without regard to race, color, religion, sex, national origin, sexual orientation, gender identity, disability or protected veteran status. Disney fosters a business culture where ideas and decisions from all people help us grow, innovate, create the best stories and be relevant in a rapidly changing world.Apply Now Apply LaterExplore Location","Walt Disney Co.
4.0","New York, NY",10000+ employees,Company - Public,Motion Picture Production & Distribution
Jr Management Analyst (Data Management),$43K-$69K (Glassdoor est.),56000,"Salary: Commensurate with experienceGStek is seeking qualified applicants for a full-time Junior Management Analyst opening to provide Data Management Support at our Yorktown, VA location.

Job Description:

• Serves as a junior level Management Analyst assisting with planning and identifying IT service operational requirements. Provides technical knowledge to monitor and review Navy Marine Corps Intranet (NMCI) Next Generation (NGEN) compliance with Service Level Agreement (SLA) performance requirements.
• Works closely with subordinate command ACTRs to manage the access and work required under the NMCI/NGEN contract, as well as helping define the technical requirements as they relate to NMCLANT business.
• Assists on matters of DOD, Navy, USFF, NMCLANT instructions and policies with regard to NMCI/NGEN. Assists in coordinating the management, development, implementation, and use of automated information systems.

Job Requirements:

Required:

• Ability to manage time, make sound decisions, take independent action, analyze problems and provide focused solutions. Professional demeanor, good people skills, ability to communicate effectively, and perform in a multi-tasked and dynamic environment.
• Knowledge of NMCI/NGEN processes and procedures specifically for NIPR and SIPR services.
• Knowledge of IT concepts and terminology as related to the management of the organizations IT resources, and the formulation and dissemination of IT policies and plans needed to support the mission of the organization.
• Knowledge of a wide range of computer applications, services, techniques, requirements, methods, and procedures including familiarity with approaches used by other government agencies and/or the private sector to accomplish a variety of projects and task in the assigned specialty areas.
• Knowledge of the Navy Marine Corps Intranet contract and other NMCI-related systems, such as NET, eMarketplace, etc. to include the following:
Look up
Certify pre-invoices
Create orders and build-outs in NET and submit.
Validate rollovers and lookup records in NET.
eMarketplace (eMp) functions
• Knowledge of the capabilities and limitations of various equipment configurations, system software, and utility programs to carry out NMCLANT information technology projects and coordinate efforts with subordinate activities.
• The ability to work closely with NMCI Service Field Service Technicians.
• Active Security Clearance

Clearance:

Selected applicants will be subject to a government security investigation and must meet eligibility requirements for access to classified information. Hire dates are dependent upon the issuance of an interim or final government security clearance.

Background Check:

Offers are contingent upon successful completion of professional reference checks, employment history verification, and background screening.

GStek, Inc. is proud to be an Affirmative Action/Equal Opportunity employer. All qualified applicants will receive consideration for employment without regard to race, color, religion, sex, sexual orientation, gender identity, national origin, disability status, or any other characteristic protected by law.

GStek encourages veterans, disabled veterans, and disabled individuals to apply for any open position for which they feel they are qualified.

EOE Minority/Female/Veteran/Disabled","GStek, Inc.
3.2","Yorktown, VA",201 to 500 employees,Company - Private,Aerospace & Defense
Data Analyst,$28K-$52K (Glassdoor est.),40000,"Data Analyst

Required Skills:
Must have 1-3 years of experience in a professional data analysis
Knowledge of Microsoft Office and components, including Access
Experience creating schedules in Excel is required
Experience with relational databases, SQL, Crystal Reports.
Some familiarity with IT groups will be required
Analyze data using appropriate control and run charts
Must be strong with Math numerator and denominator
Must be comfortable in a fast-paced environment
Must be polished and able to present to Executives if needed
Must be driven and eager to learn
Must have a great attitude
Excellent written and verbal communication skills are ABSOLUTELY required
Must be accountable, this group is the top of their department and they must be able to trust you


Desired Skills:
Degree in HIM
Healthcare Data Analysis
Description of Role/Responsibilities:
We are looking for a Data Analyst to join an expanding team at one of the most well respected Health Care organizations in Columbus. Our client is seeking a Data Analyst in their Quality Improvement Services department. This position is responsible for reviewing and analyzing data that supports assigned projects in Quality Improvement Services; will maintain databases and sources of information for quality initiatives, accreditation efforts, regulatory mandates, contractual requirement and ad hoc requests; position coordinates data from various sources.
Find Us on Facebook!
Follow Us on Twitter!

Beacon Hill is an Equal Opportunity Employer that values the strength diversity brings to the workplace. Individuals with Disabilities and Protected Veterans are encouraged to apply.

Company Profile:

Beacon Hill Technologies, a premier National Information Technology Staffing Group, provides world class technology talent across all industries on a contract, direct (permanent), contract-to-direct and project basis. Beacon Hill Technologies' dedicated team of recruiting and staffing experts consistently delivers quality IT professionals to solve our customers' technical and business needs.

Beacon Hill Technologies covers a broad spectrum of IT positions, including Project Management and Business Analysis, Programming/Development, Database, Infrastructure, Quality Assurance, Production/Support and ERP roles.

Learn more about Beacon Hill Staffing Group and our specialty divisions, Beacon Hill Associates, Beacon Hill Financial, Beacon Hill HR, Beacon Hill Legal, Beacon Hill Pharma and Beacon Hill Technologies by visiting www.beaconhillstaffing.com.

We look forward to working with you.

Beacon Hill. Employing the Future","Beacon Hill Staffing Group
4.5","Columbus, OH",501 to 1000 employees,Company - Private,Staffing & Outsourcing
Financial Data Analyst,$44K-$82K (Glassdoor est.),63000,"CarOffer is rapidly growing their Accounting/Finance team and seeking a Financial Data Analyst to support the growth. The Financial Data Analyst will prepare financial reports that serve as summary information for managers and is responsible for identifying relevant insights and compiling analytical reports that support business decisions. This position is responsible for collecting information from all areas of the company. Other responsibilities may include improving current methods used in the collection of data from other parts of the company while retaining the essential integrity and security of the information collected. The reports prepared may also delve into the realm of non-financial reporting, depending on the needs of the hiring company. Overall, the role is to encourage the transfer of relevant knowledge to the parties that require it the most.

Responsibilities:

Compiling, interpreting and reporting on information on company financials (and others as needed).
Analyze past results, perform variance analysis, identify trends, and make recommendations for improvements
Work closely with the accounting team to ensure accurate financial reporting
Evaluate financial performance by comparing and analyzing actual results with plans and forecasts


Skills/Requirements:

Minimum education requirement: Associates degree
Business finance or other relevant experience preferred
High proficiency in financial modeling techniques
Strong fluency with Excel formulas and functions
Strong analytical and data gathering skills
Good business acumen
Ability to communicate ideas both verbally and in writing to Leadership team","CarOffer
2.6","Plano, TX",51 to 200 employees,Company - Private,Consumer Product Rental
Sr Data Analyst,$50K-$86K (Glassdoor est.),68000,"The Senior Data Analyst is leads the production of data collection, research, analysis and presentation of findings that affect portfolio performance. This role will oversee the maintenance and compliance of various analyses. This position will conduct studies and produce reports utilizing complex data tools to mitigate risks and identify opportunities. The Sr. Data Analyst will work alongside various business units including IT to create streamlined data and decision-support solutions. This role will be required to assist in modeling efforts. This position will interact with other departments as the subject matter expert with an in depth knowledge of quantitative methods and diligent knowledge of data sources and tools in the interest of achieving the overall company objectives.

JOB DUTIES
Uses appropriate programming languages (Python, SAS, R) to develop business and operational reporting and data visualizations that enable effective and efficient decision-making
Builds technical knowledge to support research and analytic responsibilities through independent learning
Maintains thorough understanding of relevant data sources and metrics
Analyzes key metrics and performing data analysis
Leads work with IT and key business units to identify opportunities and inconsistencies in data and develops long term solutions for data capture and maintenance and serves as a subject matter expert
Extracts meaningful insights and trends and makes recommendations for various analyses to senior leadership which will improve business performance
Partners with and provides recommendations to business leadership on the appropriate application of analytics to business strategies and effectively communicates analysis and implications to senior leadership
Serves as a technical and analytical mentor to less experienced analysts
Ensures that the delivered products meet the business needs of the company
Perform other duties as assigned
Conform with all company policies and procedures

Knowledge
Ability to wrangle large datasets, structured and non-structured data, including data mining and manipulation
Demonstrated understanding and experience with technical systems, datasets, data warehouses, data analysis techniques and data visualization
Knowledge of consumer auto lending / leasing portfolio preferred
Ability to design and implement process documentation and monitoring protocols, demonstrated understanding and experience with technical systems, relational and dimensional datasets, data warehouses, and data analysis techniques
Strong quantitative, analytical and data interpretation skills
Ability to summarize complex data into digestible information for management
Skills
MS Office required
Advanced skills in programming languages such as Python, SAS, R or similar required
Experience in data visualization best practices and tools such as Power BI, Tableau, SAS Visual Analytics etc required
Possess honed research skills
Strong written and verbal presentation skills with an ability to communicate effectively with Senior Management by making complex concepts easy to understand
Ability to be curious, ask questions, explore, and be creative when analyzing data and business problems
Demonstrated quantitative skills
Acute attention to detail
Ability to interact collaboratively with internal customers and external vendors
Capable of supporting multiple projects, including the ability to coordinate and balance numerous tasks in a time-sensitive environment, under pressure and meeting deadlines
Education
Bachelor’s Degree in Economics, Mathematics, Business Analytics, Computer Science, Statistics or other quantitative field required
Master’s Degree in Economics, Mathematics, Business Analytics, Computer Science, Statistics or other quantitative field preferred
Experience
4 - 6 years of data mining and query tool experience required
4 - 6 years in similar role required
4 - 6 years in auto finance preferred
Working Conditions
Normal office environment
#LI-KR1","GM Financial
2.9","Fort Worth, TX",5001 to 10000 employees,Company - Public,Lending
Live Operations Data Analyst,$42K-$76K (Glassdoor est.),59000,"Job Overview


Wargaming North America is looking for Live Operations Data Analyst to join our Live Operations team. In this role, you will be the go-to person for data and analytics in Wargaming North America publishing department.

What you will do?
Provide data and analytic support for WG North America Liveops, Publishing and Marketing departments: Service-Sided Events (SSE), Customer Relationship Management (CRM) and Player Relationship Management Platform (PRMP), Marketing Campaigns.
Use historical data to identify and suggest business growth opportunities.
Build automated Tableau dashboards to track Wargaming NA publishing activities.
Interact with regional Product Groups to build yearly and monthly product forecasts.
Be the key person in NA region for data-related requests.
Collaborate with Wargaming Business Intelligence (WGBI) and regional analysts to scale successful data products globally.
Support marketing campaign analysis in coordination with Liveops and Marketing Analysts.
Drive community and social media analysis for NA Publishing, particularly with YouTube and Twitch.
Conduct ad-hoc research for WG publishing units.
Liaise with HQ and regional data owners to standardize information and reporting.
Contribute to Wargaming BI network to build a common knowledgebase and share best practices.
What are we looking for?
1-3 years of experience in analytics
Knowledge of SQL
Knowledge of Tableau or similar data visualization tool
Knowledge of Excel
Fluency in English
What additional skills will help you stand out?
Experience building ETL process
Business mindset
Excellent soft skills
Knowledge of Wargaming games
About Us


Wargaming is an award-winning online game developer and publisher headquartered in Nicosia, Cyprus. Delivering legendary games since 1998, Wargaming has grown to become one of the leaders in the free-to-play MMO gaming industry with 4500+ employees and more than 20 offices globally. Over 200 million players enjoy Wargaming's titles across all major gaming platforms, including the massively popular World of Tanks and World of Warships.

Working in our company means always having interesting challenges and gaining valuable experience while working with top-class experts.

Take your place among our passionate and experienced team and bring out the best in yourself at Wargaming! .

Please see Wargaming Candidate Privacy Policy for details on how Wargaming uses your personal data.","Wargaming
3.8","Austin, TX",1001 to 5000 employees,Company - Private,Video Games
